{
  "expected_outcome": {},
  "fixture_id": "null_delivery_cost",
  "generator_version": "1.0.0",
  "origin": "mutated",
  "payload": {
    "calculation": {
      "delivery": {
        "total": null
      },
      "productsTotal": 100.0,
      "subDiscount": 0,
      "subTotal": 133.89,
      "total": 133.89,
      "totalAfterDiscounts": 133.89,
      "validations": []
    },
    "deliveryType": "NovaPoshta",
    "id": "synthetic-null_delivery_cost",
    "shipments": [
      {
        "branchId": "branch-1",
        "companyId": "company-1",
        "id": "synthetic-null_delivery_cost",
        "products": [
          {
            "name": "Synthetic item",
            "price": 100.0,
            "productId": "product-4056",
            "quantity": 1,
            "stock": 10
          }
        ]
      }
    ],
    "timeslot": {
      "end": "2026-09-08T12:00:00+00:00",
      "start": "2026-09-08T10:00:00+00:00"
    }
  },
  "seed": 20260907,
  "source_schema_hash": "synthetic-cart-wire-shape-v1",
  "transformations": [
    "calculation.delivery.total is null, not zero (DR-05)"
  ]
}