{
  "expected_outcome": {},
  "fixture_id": "money_as_minor_units_string",
  "generator_version": "1.0.0",
  "origin": "synthetic",
  "payload": {
    "calculation": {
      "delivery": {
        "total": 33.89
      },
      "productsTotal": "639.65",
      "subDiscount": 0,
      "subTotal": 133.89,
      "total": 133.89,
      "totalAfterDiscounts": 133.89,
      "validations": []
    },
    "deliveryType": "NovaPoshta",
    "id": "synthetic-money_as_minor_units_string",
    "shipments": [
      {
        "branchId": "branch-1",
        "companyId": "company-1",
        "id": "synthetic-money_as_minor_units_string",
        "products": [
          {
            "name": "Synthetic item",
            "price": 100.0,
            "productId": "product-3409",
            "quantity": 1,
            "stock": 10
          }
        ]
      }
    ],
    "timeslot": {
      "end": "2026-09-08T12:00:00+00:00",
      "start": "2026-09-08T10:00:00+00:00"
    }
  },
  "seed": 20260907,
  "source_schema_hash": "synthetic-cart-wire-shape-v1",
  "transformations": [
    "productsTotal arrives as a JSON string, not a float"
  ]
}