{
  "fixture_id": "cart_multi_item_diverse",
  "origin": "recorded",
  "source_schema_hash": "live-2026-09-06",
  "generator_version": "n/a-recorded",
  "seed": null,
  "transformations": [],
  "expected_outcome": {},
  "payload": {
    "success": true,
    "cart": {
      "deliveryType": "NovaPoshta",
      "timeslot": {
        "start": "2026-09-10T09:00:00+00:00",
        "end": "2026-09-10T15:00:00+00:00"
      },
      "shipments": [
        {
          "companyId": "test_company_001",
          "branchId": "test_branch_002",
          "products": [
            {
              "productId": "test_product_003",
              "companyId": "test_company_001",
              "branchId": "test_branch_002",
              "slug": "moloko-galychyna-z-chystykh-karpat-2-5-716286",
              "name": "Молоко «Галичина» «З чистих Карпат» 2,5%",
              "quantity": 3,
              "price": 39.99,
              "oldPrice": 62.49,
              "subTotal": 187.47,
              "subDiscount": 67.5,
              "total": 119.97,
              "stock": 599,
              "weighted": false
            },
            {
              "productId": "test_product_004",
              "companyId": "test_company_001",
              "branchId": "test_branch_002",
              "slug": "pyvo-kronenbourg-blanc-609226",
              "name": "Пиво Kronenbourg Blanc",
              "quantity": 3,
              "price": 39.99,
              "oldPrice": 71.99,
              "subTotal": 215.97,
              "subDiscount": 96,
              "total": 119.97,
              "stock": 168,
              "weighted": false
            },
            {
              "productId": "test_product_005",
              "companyId": "test_company_001",
              "branchId": "test_branch_002",
              "slug": "servetky-vologi-premiia-dlia-prybyrannia-universalni-991469",
              "name": "Серветки вологі «Премія»® для прибирання універсальні",
              "quantity": 3,
              "price": 34.99,
              "oldPrice": 64.99,
              "subTotal": 194.97,
              "subDiscount": 90,
              "total": 104.97,
              "stock": 17,
              "weighted": false
            },
            {
              "productId": "test_product_006",
              "companyId": "test_company_001",
              "branchId": "test_branch_002",
              "slug": "vershky-premiia-ultrapasteryzovani-15-1018453",
              "name": "Вершки «Премія»® ультрапастеризовані 15%",
              "quantity": 2,
              "price": 29.99,
              "oldPrice": 42.49,
              "subTotal": 84.98,
              "subDiscount": 25,
              "total": 59.98,
              "stock": 11,
              "weighted": false
            },
            {
              "productId": "test_product_007",
              "companyId": "test_company_001",
              "branchId": "test_branch_002",
              "slug": "vershky-ferma-ultrapasteryzovani-vidbirni-33-692625",
              "name": "Вершки «Ферма» ультрапастеризовані відбірні 33%",
              "quantity": 1,
              "price": 144,
              "oldPrice": 239,
              "subTotal": 239,
              "subDiscount": 95,
              "total": 144,
              "stock": 109,
              "weighted": false
            },
            {
              "productId": "test_product_008",
              "companyId": "test_company_001",
              "branchId": "test_branch_002",
              "slug": "termochashka-eat-drink-500-ml-986978-986978",
              "name": "Термочашка Eat&Drink 500 мл 986978",
              "quantity": 1,
              "price": 199,
              "oldPrice": 829,
              "subTotal": 829,
              "subDiscount": 630,
              "total": 199,
              "stock": 1,
              "weighted": false
            },
            {
              "productId": "test_product_009",
              "companyId": "test_company_001",
              "branchId": "test_branch_002",
              "slug": "shchitka-zubna-arblin-m-iaka-v-asortymenti-942192",
              "name": "Щітка зубна Arblin м'яка в асортименті",
              "quantity": 1,
              "price": 29.99,
              "oldPrice": 64.99,
              "subTotal": 64.99,
              "subDiscount": 35,
              "total": 29.99,
              "stock": 10,
              "weighted": false
            },
            {
              "productId": "test_product_010",
              "companyId": "test_company_001",
              "branchId": "test_branch_002",
              "slug": "kukurudza-welldar-tsukrova-sterylizovana-z-b-kliuch-938685",
              "name": "Кукурудза WellDar цукрова стерилізована з/б ключ",
              "quantity": 1,
              "price": 57.99,
              "oldPrice": 70.99,
              "subTotal": 70.99,
              "subDiscount": 13,
              "total": 57.99,
              "stock": 28,
              "weighted": false
            },
            {
              "productId": "test_product_011",
              "companyId": "test_company_001",
              "branchId": "test_branch_002",
              "slug": "pechinka-trisky-premiia-545700",
              "name": "Печінка тріски «Премія»®",
              "quantity": 1,
              "price": 147.6,
              "oldPrice": null,
              "subTotal": 164,
              "subDiscount": 16.4,
              "total": 147.6,
              "stock": 1,
              "weighted": false
            },
            {
              "productId": "test_product_012",
              "companyId": "test_company_001",
              "branchId": "test_branch_002",
              "slug": "inzhyr-good-fig-sushenyi-1022290",
              "name": "Інжир Good Fig сушений",
              "quantity": 1,
              "price": 239.2,
              "oldPrice": 299,
              "subTotal": 299,
              "subDiscount": 59.8,
              "total": 239.2,
              "stock": 10,
              "weighted": false
            },
            {
              "productId": "test_product_013",
              "companyId": "test_company_001",
              "branchId": "test_branch_002",
              "slug": "chypsy-iabluchni-premiia-oryginalni-922330",
              "name": "Чипси яблучні «Премія»® оригінальні",
              "quantity": 1,
              "price": 56.52,
              "oldPrice": 66.49,
              "subTotal": 66.49,
              "subDiscount": 9.97,
              "total": 56.52,
              "stock": 3,
              "weighted": false
            }
          ]
        }
      ],
      "calculation": {
        "total": 1408.19,
        "totalAfterDiscounts": 1363.26,
        "subTotal": 2545.86,
        "subDiscount": 1137.67,
        "productsTotal": 1279.19,
        "delivery": {
          "total": 129
        },
        "payment": {
          "availableTypes": []
        },
        "validations": []
      }
    }
  }
}