{
  "expected_outcome": {},
  "fixture_id": "unknown_validation_code",
  "generator_version": "1.0.0",
  "origin": "mutated",
  "payload": {
    "calculation": {
      "delivery": {
        "total": 33.89
      },
      "productsTotal": 100.0,
      "subDiscount": 0,
      "subTotal": 133.89,
      "total": 133.89,
      "totalAfterDiscounts": 133.89,
      "validations": [
        {
          "context": {
            "productId": "product-4217"
          },
          "level": "error",
          "message": "product.offer.status.not_available",
          "type": "product"
        }
      ]
    },
    "deliveryType": "NovaPoshta",
    "id": "synthetic-unknown_validation_code",
    "shipments": [
      {
        "branchId": "branch-1",
        "companyId": "company-1",
        "id": "synthetic-unknown_validation_code",
        "products": [
          {
            "name": "Synthetic item",
            "price": 100.0,
            "productId": "product-4217",
            "quantity": 1,
            "stock": 10
          }
        ]
      }
    ],
    "timeslot": {
      "end": "2026-09-08T12:00:00+00:00",
      "start": "2026-09-08T10:00:00+00:00"
    }
  },
  "seed": 20260907,
  "source_schema_hash": "synthetic-cart-wire-shape-v1",
  "transformations": [
    "a validation code not in the registry"
  ]
}